{
  "schemaVersion": "mei-app-launch-v1",
  "appId": "mini-data",
  "displayName": "Mini Data · full",
  "generation": "current",
  "runtimePlan": {
    "defaultMode": "hot",
    "apps": {}
  },
  "warmup": {
    "enabled": true,
    "apps": {
      "mini-data": {
        "hotScenes": [
          "home"
        ],
        "compileScope": {
          "skipDiscover": true
        },
        "focuses": [
          "src/scene/home/t1/r-right-rail/s-warning/content.mei",
          "src/scene/home/t1/r-right-rail/s-enforcement/content.mei"
        ],
        "xlsxSources": [
          {
            "path": "upload/9.监督事项清单.xlsx"
          },
          {
            "path": "upload/10.预警模型清单.xlsx"
          },
          {
            "path": "upload/11.预警清单、问题跟踪清单20260606.xlsx"
          }
        ],
        "csvSources": [
          {
            "path": "upload/enforcement-objects.csv"
          }
        ],
        "datasets": [
          {
            "sceneId": "home",
            "datasetId": "metrics/supervision-warning.bundle.mei",
            "metricIds": [
              "supervision_items_count",
              "supervision_models_count",
              "warnings_count"
            ]
          },
          {
            "sceneId": "home",
            "datasetId": "metrics/enforcement-objects.bundle.mei",
            "metricIds": [
              "enforcement_objects_count",
              "key_enterprises_count",
              "park_count",
              "whitelist_enterprises_count"
            ]
          }
        ]
      }
    }
  },
  "menu": {
    "items": [
      {
        "app_id": "mini-data",
        "label": "真实数据 · Mini Data（full）",
        "order": 10
      }
    ]
  }
}
