{
  "schemaVersion": "mei-app-launch-v1",
  "appId": "mini-data",
  "displayName": "Mini Data · scoped 监督预警",
  "generation": "current",
  "runtimePlan": {
    "defaultMode": "frozen",
    "apps": {
      "mini-data": {
        "targets": [
          {
            "scope": "home/t1/r-right-rail/s-warning",
            "mode": "hot"
          },
          {
            "scope": "warnings_analytics_page",
            "mode": "lazy"
          },
          {
            "scope": "supervision_items_analytics_page",
            "mode": "lazy"
          },
          {
            "scope": "supervision_models_analytics_page",
            "mode": "lazy"
          },
          {
            "scope": "home/t1/r-right-rail/s-enforcement",
            "mode": "frozen"
          },
          {
            "scope": "enforcement_analytics_page",
            "mode": "frozen"
          }
        ],
        "metricOverrides": {
          "warnings_count": "hot",
          "supervision_items_count": "frozen",
          "supervision_models_count": "lazy",
          "enforcement_objects_count": "frozen",
          "key_enterprises_count": "frozen",
          "park_count": "frozen",
          "whitelist_enterprises_count": "frozen"
        }
      }
    }
  },
  "warmup": {
    "enabled": true,
    "apps": {
      "mini-data": {
        "hotScenes": [
          "home"
        ],
        "compileScope": {
          "skipDiscover": true
        },
        "focuses": [
          "src/scene/home/t1/r-right-rail/s-warning/content.mei"
        ],
        "xlsxSources": [
          {
            "path": "upload/9.监督事项清单.xlsx"
          },
          {
            "path": "upload/10.预警模型清单.xlsx"
          },
          {
            "path": "upload/11.预警清单、问题跟踪清单20260606.xlsx"
          }
        ],
        "datasets": [
          {
            "sceneId": "home",
            "datasetId": "metrics/supervision-warning.bundle.mei",
            "metricIds": [
              "warnings_count",
              "supervision_items_count",
              "supervision_models_count"
            ]
          }
        ]
      }
    }
  },
  "menu": {
    "items": [
      {
        "app_id": "mini-data",
        "label": "真实数据 · Mini Data（监督预警 scoped）",
        "order": 10
      }
    ]
  }
}
